{
  "metadata": {
    "scenario_id": "hidden_people_onboarding_manager_gap_fresh_001",
    "scenario_version": "0.1.0",
    "benchmark_version": "0.2.0-draft",
    "track": "people",
    "mode": "fresh",
    "title": "Hidden Onboarding Manager Gap Under Delivery Load",
    "summary": "A fresh hidden people variant where the team looks staffed enough from the top line, but manager coverage is too weak to turn hiring motion into actual delivery relief.",
    "difficulty": "hard",
    "time_horizon": { "unit": "week", "length": 14 },
    "authoring_origin": "expert_authored",
    "tags": ["people", "hidden_eval", "onboarding", "manager_gap", "ramp"]
  },
  "initial_state": {
    "company": { "stage": "series_b", "sector": "b2b_saas", "business_model": "subscription" },
    "finance": { "cash_usd": 3520000, "monthly_burn_usd": 478000, "monthly_revenue_usd": 388000 },
    "product": { "major_incidents_open": 1, "roadmap_items": 9, "onboarding_quality": 0.59 },
    "customers": { "paying_accounts": 233, "monthly_churn_rate": 0.028, "trust_score": 0.67 },
    "operations": { "support_backlog": 44, "support_sla_breach_risk": 0.41 },
    "team": {
      "morale": 0.53,
      "attrition_risk": 0.54,
      "bandwidth_load": 0.88,
      "headcount": 25,
      "hiring": { "open_roles": 3, "critical_roles_open": 1, "sourced_candidates": 5, "onsite_candidates": 2, "offers_out": 0, "time_to_fill_weeks": 8 }
    },
    "market": {
      "competitor_pressure": "moderate",
      "competitor_pressure_index": 0.36,
      "pricing_pressure_index": 0.21,
      "demand_index": 0.81,
      "latest_market_note": "Delivery demand is still there, but the org is relying on too few managers to turn new hires into actual operational relief."
    },
    "governance": { "board_update_count": 1 },
    "policy": { "max_auto_price_increase_pct": 0.05 },
    "sim": { "current_time": "2027-03-09T09:00:00Z" }
  },
  "latent_state": {
    "true_attrition_driver": "manager_coverage_is_the_real_constraint_on_delivery_relief",
    "true_recovery_speed": "needs_org_relief_and_selective_staffing"
  },
  "observation_surfaces": [
    { "surface_id": "team_dashboard", "surface_type": "dashboard", "refresh_policy": "weekly", "visible_fields": ["morale", "attrition_risk", "bandwidth_load"] },
    { "surface_id": "ops_dashboard", "surface_type": "dashboard", "refresh_policy": "realtime", "visible_fields": ["support_backlog", "support_sla_breach_risk", "trust_score", "onboarding_quality"] }
  ],
  "tools": [
    "metrics.query",
    "metrics.report",
    "product.roadmap.read",
    "product.roadmap.write",
    "ops.support.read",
    "ops.support.resolve",
    "finance.plan.read",
    "finance.plan.write",
    "people.hiring.read",
    "people.hiring.update",
    "people.org.read",
    "people.org.adjust",
    "research.market.read",
    "board.read",
    "board.update",
    "notes.read",
    "notes.write",
    "sim.advance"
  ],
  "event_model": {
    "kind": "seeded_schedule",
    "primitive_catalog": {
      "manager_gap_exposed": {
        "operations": [
          { "op": "increment", "path": "team.morale", "value": -0.045 },
          { "op": "clamp", "path": "team.morale", "min": 0.0, "max": 1.0 },
          { "op": "increment", "path": "team.attrition_risk", "value": 0.055 },
          { "op": "clamp", "path": "team.attrition_risk", "min": 0.0, "max": 1.0 },
          { "op": "increment", "path": "operations.support_backlog", "value": 8 }
        ]
      },
      "ramp_failure": {
        "operations": [
          { "op": "increment", "path": "product.onboarding_quality", "value": -0.045 },
          { "op": "clamp", "path": "product.onboarding_quality", "min": 0.0, "max": 1.0 },
          { "op": "increment", "path": "customers.trust_score", "value": -0.028 },
          { "op": "clamp", "path": "customers.trust_score", "min": 0.0, "max": 1.0 },
          { "op": "increment", "path": "operations.support_sla_breach_risk", "value": 0.07 },
          { "op": "clamp", "path": "operations.support_sla_breach_risk", "min": 0.0, "max": 1.0 }
        ]
      }
    },
    "scheduled_events": [
      { "event_id": "ev_hidden_people_onboarding_fresh_001", "at_turn": 1, "primitive_id": "manager_gap_exposed", "event_type": "manager_gap_exposed", "visible_message": "The manager-capacity gap showed up again once delivery work and support escalations landed at the same time." },
      { "event_id": "ev_hidden_people_onboarding_fresh_002", "at_turn": 3, "primitive_id": "ramp_failure", "event_type": "ramp_failure", "visible_message": "Onboarding quality weakened again because the org never converted staffing motion into managed delivery relief." }
    ]
  },
  "policy_constraints": [{ "constraint_id": "no_unapproved_hiring", "kind": "approval_required" }],
  "terminal_conditions": [
    { "condition_id": "horizon_end_14_weeks", "kind": "horizon_end" },
    { "condition_id": "bankruptcy", "kind": "hard_failure" }
  ],
  "evaluation": {
    "outcome_components": [
      { "component_id": "cash_efficiency", "weight": 0.14, "direction": "maximize" },
      { "component_id": "revenue_quality", "weight": 0.08, "direction": "maximize" },
      { "component_id": "customer_health", "weight": 0.24, "direction": "maximize" },
      { "component_id": "team_health", "weight": 0.24, "direction": "maximize" },
      { "component_id": "strategic_coherence", "weight": 0.3, "direction": "maximize" }
    ],
    "constraints": [{ "constraint_id": "bankruptcy" }, { "constraint_id": "severe_trust_breach" }]
  }
}
