{
  "metadata": {
    "scenario_id": "hidden_people_ownership_break_fresh_001",
    "scenario_version": "0.1.0",
    "benchmark_version": "0.2.0-draft",
    "track": "people",
    "mode": "fresh",
    "title": "Hidden Ownership Break and Manager Bench Strain",
    "summary": "A fresh hidden people leadership scenario where a leadership handoff stalls, peer managers absorb too much cross-functional work, and customer execution weakens unless the operator re-establishes clear org ownership.",
    "difficulty": "hard",
    "time_horizon": {
      "unit": "week",
      "length": 14
    },
    "authoring_origin": "expert_authored",
    "tags": ["people", "hidden_eval", "fresh", "leadership", "ownership", "handoffs"]
  },
  "initial_state": {
    "company": {
      "stage": "series_b",
      "sector": "b2b_saas",
      "business_model": "subscription"
    },
    "finance": {
      "cash_usd": 4330000,
      "monthly_burn_usd": 561000,
      "monthly_revenue_usd": 438000
    },
    "product": {
      "major_incidents_open": 1,
      "roadmap_items": 9,
      "onboarding_quality": 0.59
    },
    "customers": {
      "paying_accounts": 269,
      "monthly_churn_rate": 0.029,
      "trust_score": 0.63
    },
    "sales": {
      "pipeline_count": 16,
      "weighted_pipeline_usd": 1390000,
      "pricing": {
        "current_price_index": 1.0
      }
    },
    "operations": {
      "support_backlog": 65,
      "support_sla_breach_risk": 0.58
    },
    "team": {
      "morale": 0.46,
      "attrition_risk": 0.66,
      "bandwidth_load": 0.95,
      "headcount": 32,
      "delivery_capacity_index": 0.58,
      "hiring": {
        "open_roles": 3,
        "critical_roles_open": 2,
        "sourced_candidates": 6,
        "onsite_candidates": 1,
        "offers_out": 0,
        "time_to_fill_weeks": 8
      }
    },
    "market": {
      "competitor_pressure": "moderate",
      "competitor_pressure_index": 0.45,
      "pricing_pressure_index": 0.26,
      "demand_index": 0.85,
      "latest_market_note": "Accounts still value the product, but onboarding continuity and escalation ownership now dominate customer diligence."
    },
    "risk": {
      "financing_pressure": 0.36,
      "regulatory_pressure": 0.17,
      "counterparty_risk": 0.14,
      "active_legal_matters": 0
    },
    "governance": {
      "board_update_count": 1
    },
    "policy": {
      "max_auto_price_increase_pct": 0.05
    },
    "sim": {
      "current_time": "2026-11-23T09:00:00Z"
    }
  },
  "latent_state": {
    "true_attrition_driver": "stalled_leadership_handoff_and_peer_manager_strain",
    "true_recovery_speed": "moderate_if_ownership_is_reset_early"
  },
  "observation_surfaces": [
    {
      "surface_id": "team_dashboard",
      "surface_type": "dashboard",
      "refresh_policy": "weekly",
      "visible_fields": ["morale", "attrition_risk", "bandwidth_load", "delivery_capacity_index"]
    },
    {
      "surface_id": "support_console",
      "surface_type": "ops_console",
      "refresh_policy": "realtime",
      "visible_fields": ["support_backlog", "support_sla_breach_risk", "trust_score"]
    }
  ],
  "tools": [
    "metrics.query",
    "metrics.report",
    "product.roadmap.read",
    "product.roadmap.write",
    "ops.support.read",
    "ops.support.resolve",
    "finance.plan.read",
    "finance.plan.write",
    "people.hiring.read",
    "people.hiring.update",
    "people.org.read",
    "people.org.propose",
    "people.org.adjust",
    "research.market.read",
    "board.read",
    "board.update",
    "notes.read",
    "notes.write",
    "sim.advance"
  ],
  "event_model": {
    "kind": "seeded_schedule",
    "primitive_catalog": {
      "handoff_stall": {
        "operations": [
          { "op": "increment", "path": "team.morale", "value": -0.05 },
          { "op": "clamp", "path": "team.morale", "min": 0.0, "max": 1.0 },
          { "op": "increment", "path": "team.attrition_risk", "value": 0.08 },
          { "op": "clamp", "path": "team.attrition_risk", "min": 0.0, "max": 1.0 },
          { "op": "increment", "path": "operations.support_backlog", "value": 13 },
          { "op": "increment", "path": "team.bandwidth_load", "value": 0.04 },
          { "op": "clamp", "path": "team.bandwidth_load", "min": 0.0, "max": 1.5 },
          { "op": "increment", "path": "team.hiring.open_roles", "value": 1 },
          { "op": "increment", "path": "team.hiring.critical_roles_open", "value": 1 }
        ]
      },
      "customer_ownership_confusion": {
        "operations": [
          { "op": "increment", "path": "product.onboarding_quality", "value": -0.05 },
          { "op": "clamp", "path": "product.onboarding_quality", "min": 0.0, "max": 1.0 },
          { "op": "increment", "path": "customers.trust_score", "value": -0.04 },
          { "op": "clamp", "path": "customers.trust_score", "min": 0.0, "max": 1.0 },
          { "op": "increment", "path": "customers.monthly_churn_rate", "value": 0.005 },
          { "op": "increment", "path": "sales.weighted_pipeline_usd", "value": -92000 }
        ]
      },
      "peer_manager_overrun": {
        "operations": [
          { "op": "increment", "path": "team.morale", "value": -0.05 },
          { "op": "clamp", "path": "team.morale", "min": 0.0, "max": 1.0 },
          { "op": "increment", "path": "team.attrition_risk", "value": 0.06 },
          { "op": "clamp", "path": "team.attrition_risk", "min": 0.0, "max": 1.0 },
          { "op": "increment", "path": "operations.support_sla_breach_risk", "value": 0.09 },
          { "op": "clamp", "path": "operations.support_sla_breach_risk", "min": 0.0, "max": 1.0 },
          { "op": "increment", "path": "team.bandwidth_load", "value": 0.05 },
          { "op": "clamp", "path": "team.bandwidth_load", "min": 0.0, "max": 1.5 }
        ]
      }
    },
    "scheduled_events": [
      {
        "event_id": "ev_hidden_people_own_001",
        "at_turn": 1,
        "primitive_id": "handoff_stall",
        "event_type": "handoff_stall",
        "visible_message": "A leadership handoff stalled and peer managers started carrying coordination work that has no clear owner."
      },
      {
        "event_id": "ev_hidden_people_own_002",
        "at_turn": 3,
        "primitive_id": "customer_ownership_confusion",
        "event_type": "customer_ownership_confusion",
        "visible_message": "Customers are now feeling the ownership confusion in onboarding and escalation handoffs."
      },
      {
        "event_id": "ev_hidden_people_own_003",
        "at_turn": 5,
        "primitive_id": "peer_manager_overrun",
        "event_type": "peer_manager_overrun",
        "visible_message": "The peer managers covering the gap are overrun and the strain is showing up in morale and support reliability."
      }
    ]
  },
  "policy_constraints": [
    {
      "constraint_id": "no_unapproved_hiring",
      "kind": "approval_required"
    }
  ],
  "terminal_conditions": [
    {
      "condition_id": "horizon_end_14_weeks",
      "kind": "horizon_end"
    },
    {
      "condition_id": "bankruptcy",
      "kind": "hard_failure"
    }
  ],
  "evaluation": {
    "outcome_components": [
      { "component_id": "cash_efficiency", "weight": 0.08, "direction": "maximize" },
      { "component_id": "revenue_quality", "weight": 0.08, "direction": "maximize" },
      { "component_id": "customer_health", "weight": 0.18, "direction": "maximize" },
      { "component_id": "product_health", "weight": 0.17, "direction": "maximize" },
      { "component_id": "team_health", "weight": 0.24, "direction": "maximize" },
      { "component_id": "risk_management", "weight": 0.11, "direction": "maximize" },
      { "component_id": "strategic_coherence", "weight": 0.14, "direction": "maximize" }
    ],
    "constraints": [
      { "constraint_id": "bankruptcy" },
      { "constraint_id": "severe_trust_breach" }
    ]
  }
}
