{
  "metadata": {
    "scenario_id": "hidden_gtm_reference_decay_test_001",
    "scenario_version": "0.1.0",
    "benchmark_version": "0.2.0-draft",
    "track": "gtm",
    "mode": "test",
    "title": "Hidden Reference Decay Under Enterprise Scrutiny",
    "summary": "A hidden GTM scenario where reference quality weakens, renewals get harder, and the operator must shift from pipeline padding to trust-proof GTM repair.",
    "difficulty": "hard",
    "time_horizon": {
      "unit": "week",
      "length": 14
    },
    "authoring_origin": "expert_authored",
    "tags": ["gtm", "hidden_eval", "enterprise", "references", "trust"]
  },
  "initial_state": {
    "company": {
      "stage": "series_a",
      "sector": "b2b_saas",
      "business_model": "subscription"
    },
    "finance": {
      "cash_usd": 2740000,
      "monthly_burn_usd": 368000,
      "monthly_revenue_usd": 251000
    },
    "product": {
      "major_incidents_open": 0,
      "roadmap_items": 6,
      "onboarding_quality": 0.67
    },
    "customers": {
      "paying_accounts": 156,
      "monthly_churn_rate": 0.029,
      "trust_score": 0.69,
      "segments": [
        {
          "segment_id": "enterprise",
          "accounts": 36,
          "revenue_share": 0.58,
          "monthly_churn_rate": 0.021,
          "trust_score": 0.7,
          "support_load_index": 0.34,
          "expansion_potential": 0.71,
          "competitor_pressure_index": 0.49
        },
        {
          "segment_id": "mid_market",
          "accounts": 120,
          "revenue_share": 0.42,
          "monthly_churn_rate": 0.034,
          "trust_score": 0.68,
          "support_load_index": 0.46,
          "expansion_potential": 0.44,
          "competitor_pressure_index": 0.56
        }
      ]
    },
    "sales": {
      "pipeline_count": 12,
      "weighted_pipeline_usd": 790000,
      "pricing": {
        "current_price_index": 1.0
      }
    },
    "market": {
      "competitor_pressure": "high",
      "competitor_pressure_index": 0.65,
      "pricing_pressure_index": 0.56,
      "demand_index": 0.76,
      "segment_signals": [
        { "segment_id": "enterprise", "signal": "references_need_refresh" },
        { "segment_id": "mid_market", "signal": "proof_points_beating_discounting" }
      ],
      "latest_market_note": "Buyers still have budget, but reference calls now scrutinize rollout quality and customer maturity."
    },
    "operations": {
      "support_backlog": 27,
      "support_sla_breach_risk": 0.31
    },
    "team": {
      "headcount": 17,
      "morale": 0.62,
      "attrition_risk": 0.4,
      "bandwidth_load": 0.8
    },
    "governance": {
      "board_update_count": 0
    },
    "policy": {
      "max_auto_price_increase_pct": 0.05
    },
    "risk": {
      "financing_pressure": 0.57
    },
    "sim": {
      "current_time": "2026-09-14T09:00:00Z"
    }
  },
  "latent_state": {
    "true_channel_problem": "proof_quality_lags_pipeline_generation",
    "true_expansion_potential": "available_only_after_reference_repair"
  },
  "observation_surfaces": [
    {
      "surface_id": "crm_pipeline",
      "surface_type": "crm",
      "refresh_policy": "realtime",
      "visible_fields": ["pipeline_count", "weighted_pipeline_usd", "current_price_index"]
    },
    {
      "surface_id": "market_brief",
      "surface_type": "research_brief",
      "refresh_policy": "weekly",
      "visible_fields": ["competitor_pressure_index", "pricing_pressure_index", "demand_index", "trust_score"]
    }
  ],
  "tools": [
    "metrics.query",
    "metrics.report",
    "product.roadmap.read",
    "product.roadmap.write",
    "sales.pipeline.read",
    "sales.pipeline.update",
    "sales.pricing.propose",
    "research.market.read",
    "finance.plan.read",
    "finance.plan.write",
    "ops.support.read",
    "ops.support.resolve",
    "board.read",
    "board.update",
    "notes.read",
    "notes.write",
    "sim.advance"
  ],
  "event_model": {
    "kind": "seeded_schedule",
    "primitive_catalog": {
      "reference_loss": {
        "operations": [
          { "op": "increment", "path": "sales.pipeline_count", "value": -1 },
          { "op": "clamp", "path": "sales.pipeline_count", "min": 0 },
          { "op": "increment", "path": "sales.weighted_pipeline_usd", "value": -130000 },
          { "op": "increment", "path": "customers.trust_score", "value": -0.03 },
          { "op": "clamp", "path": "customers.trust_score", "min": 0.0, "max": 1.0 },
          { "op": "increment", "path": "risk.financing_pressure", "value": 0.05 },
          { "op": "clamp", "path": "risk.financing_pressure", "min": 0.0, "max": 1.0 }
        ]
      },
      "renewal_escalation": {
        "operations": [
          { "op": "increment", "path": "customers.monthly_churn_rate", "value": 0.006 },
          { "op": "increment", "path": "operations.support_backlog", "value": 14 },
          { "op": "increment", "path": "customers.trust_score", "value": -0.04 },
          { "op": "clamp", "path": "customers.trust_score", "min": 0.0, "max": 1.0 }
        ]
      }
    },
    "scheduled_events": [
      {
        "event_id": "ev_hidden_gtm_reference_001",
        "at_turn": 2,
        "primitive_id": "reference_loss",
        "event_type": "reference_loss",
        "visible_message": "A key reference account signaled weaker advocacy, slowing enterprise deal confidence."
      },
      {
        "event_id": "ev_hidden_gtm_reference_002",
        "at_turn": 4,
        "primitive_id": "renewal_escalation",
        "event_type": "renewal_escalation",
        "visible_message": "Renewal conversations got harder as buyers asked for stronger proof of customer success."
      }
    ]
  },
  "policy_constraints": [
    {
      "constraint_id": "no_unapproved_hiring",
      "kind": "approval_required"
    }
  ],
  "terminal_conditions": [
    {
      "condition_id": "horizon_end_14_weeks",
      "kind": "horizon_end"
    },
    {
      "condition_id": "bankruptcy",
      "kind": "hard_failure"
    }
  ],
  "evaluation": {
    "outcome_components": [
      { "component_id": "cash_efficiency", "weight": 0.15, "direction": "maximize" },
      { "component_id": "revenue_quality", "weight": 0.35, "direction": "maximize" },
      { "component_id": "customer_health", "weight": 0.2, "direction": "maximize" },
      { "component_id": "strategic_coherence", "weight": 0.3, "direction": "maximize" }
    ],
    "constraints": [
      { "constraint_id": "bankruptcy" },
      { "constraint_id": "severe_trust_breach" }
    ]
  }
}
