{
  "metadata": {
    "scenario_id": "hidden_people_exec_gap_test_001",
    "scenario_version": "0.1.0",
    "benchmark_version": "0.2.0-draft",
    "track": "people",
    "mode": "test",
    "title": "Hidden Executive Gap and Ownership Drift",
    "summary": "A hidden people leadership scenario where an executive gap and diffuse manager ownership create customer handoff failures, team fatigue, and execution drift unless leadership resets the org quickly.",
    "difficulty": "hard",
    "time_horizon": {
      "unit": "week",
      "length": 14
    },
    "authoring_origin": "expert_authored",
    "tags": ["people", "hidden_eval", "leadership", "ownership", "manager_bench"]
  },
  "initial_state": {
    "company": {
      "stage": "series_b",
      "sector": "b2b_saas",
      "business_model": "subscription"
    },
    "finance": {
      "cash_usd": 4210000,
      "monthly_burn_usd": 544000,
      "monthly_revenue_usd": 417000
    },
    "product": {
      "major_incidents_open": 1,
      "roadmap_items": 8,
      "onboarding_quality": 0.57
    },
    "customers": {
      "paying_accounts": 251,
      "monthly_churn_rate": 0.03,
      "trust_score": 0.62
    },
    "sales": {
      "pipeline_count": 15,
      "weighted_pipeline_usd": 1330000,
      "pricing": {
        "current_price_index": 1.0
      }
    },
    "operations": {
      "support_backlog": 63,
      "support_sla_breach_risk": 0.6
    },
    "team": {
      "morale": 0.44,
      "attrition_risk": 0.69,
      "bandwidth_load": 0.97,
      "headcount": 29,
      "delivery_capacity_index": 0.56,
      "hiring": {
        "open_roles": 4,
        "critical_roles_open": 2,
        "sourced_candidates": 5,
        "onsite_candidates": 1,
        "offers_out": 0,
        "time_to_fill_weeks": 9
      }
    },
    "market": {
      "competitor_pressure": "moderate",
      "competitor_pressure_index": 0.44,
      "pricing_pressure_index": 0.24,
      "demand_index": 0.84,
      "latest_market_note": "Renewal conversations now include more questions about onboarding ownership and manager continuity."
    },
    "risk": {
      "financing_pressure": 0.41,
      "regulatory_pressure": 0.19,
      "counterparty_risk": 0.16,
      "active_legal_matters": 0
    },
    "governance": {
      "board_update_count": 1
    },
    "policy": {
      "max_auto_price_increase_pct": 0.05
    },
    "sim": {
      "current_time": "2026-11-02T09:00:00Z"
    }
  },
  "latent_state": {
    "true_attrition_driver": "executive_gap_and_diffuse_manager_ownership",
    "true_recovery_speed": "slow_without_explicit_org_reset"
  },
  "observation_surfaces": [
    {
      "surface_id": "team_dashboard",
      "surface_type": "dashboard",
      "refresh_policy": "weekly",
      "visible_fields": ["morale", "attrition_risk", "bandwidth_load", "delivery_capacity_index"]
    },
    {
      "surface_id": "support_console",
      "surface_type": "ops_console",
      "refresh_policy": "realtime",
      "visible_fields": ["support_backlog", "support_sla_breach_risk", "trust_score"]
    }
  ],
  "tools": [
    "metrics.query",
    "metrics.report",
    "product.roadmap.read",
    "product.roadmap.write",
    "ops.support.read",
    "ops.support.resolve",
    "finance.plan.read",
    "finance.plan.write",
    "people.hiring.read",
    "people.hiring.update",
    "people.org.read",
    "people.org.propose",
    "people.org.adjust",
    "research.market.read",
    "board.read",
    "board.update",
    "notes.read",
    "notes.write",
    "sim.advance"
  ],
  "event_model": {
    "kind": "seeded_schedule",
    "primitive_catalog": {
      "ownership_vacuum": {
        "operations": [
          { "op": "increment", "path": "team.morale", "value": -0.06 },
          { "op": "clamp", "path": "team.morale", "min": 0.0, "max": 1.0 },
          { "op": "increment", "path": "team.attrition_risk", "value": 0.09 },
          { "op": "clamp", "path": "team.attrition_risk", "min": 0.0, "max": 1.0 },
          { "op": "increment", "path": "operations.support_backlog", "value": 15 },
          { "op": "increment", "path": "team.bandwidth_load", "value": 0.05 },
          { "op": "clamp", "path": "team.bandwidth_load", "min": 0.0, "max": 1.5 },
          { "op": "increment", "path": "team.hiring.open_roles", "value": 1 },
          { "op": "increment", "path": "team.hiring.critical_roles_open", "value": 1 }
        ]
      },
      "customer_handoff_drag": {
        "operations": [
          { "op": "increment", "path": "product.onboarding_quality", "value": -0.06 },
          { "op": "clamp", "path": "product.onboarding_quality", "min": 0.0, "max": 1.0 },
          { "op": "increment", "path": "customers.trust_score", "value": -0.035 },
          { "op": "clamp", "path": "customers.trust_score", "min": 0.0, "max": 1.0 },
          { "op": "increment", "path": "customers.monthly_churn_rate", "value": 0.006 },
          { "op": "increment", "path": "sales.weighted_pipeline_usd", "value": -85000 }
        ]
      },
      "manager_fatigue_spike": {
        "operations": [
          { "op": "increment", "path": "team.morale", "value": -0.05 },
          { "op": "clamp", "path": "team.morale", "min": 0.0, "max": 1.0 },
          { "op": "increment", "path": "team.attrition_risk", "value": 0.06 },
          { "op": "clamp", "path": "team.attrition_risk", "min": 0.0, "max": 1.0 },
          { "op": "increment", "path": "operations.support_sla_breach_risk", "value": 0.08 },
          { "op": "clamp", "path": "operations.support_sla_breach_risk", "min": 0.0, "max": 1.0 },
          { "op": "increment", "path": "team.bandwidth_load", "value": 0.04 },
          { "op": "clamp", "path": "team.bandwidth_load", "min": 0.0, "max": 1.5 }
        ]
      }
    },
    "scheduled_events": [
      {
        "event_id": "ev_hidden_people_lead_001",
        "at_turn": 1,
        "primitive_id": "ownership_vacuum",
        "event_type": "ownership_vacuum",
        "visible_message": "An executive gap widened and the remaining managers started absorbing unplanned coordination work."
      },
      {
        "event_id": "ev_hidden_people_lead_002",
        "at_turn": 3,
        "primitive_id": "customer_handoff_drag",
        "event_type": "customer_handoff_drag",
        "visible_message": "Customer handoffs drifted and the team no longer has crisp ownership for onboarding escalations."
      },
      {
        "event_id": "ev_hidden_people_lead_003",
        "at_turn": 5,
        "primitive_id": "manager_fatigue_spike",
        "event_type": "manager_fatigue_spike",
        "visible_message": "Managers are covering the gap, but fatigue is now spreading into support risk and team confidence."
      }
    ]
  },
  "policy_constraints": [
    {
      "constraint_id": "no_unapproved_hiring",
      "kind": "approval_required"
    }
  ],
  "terminal_conditions": [
    {
      "condition_id": "horizon_end_14_weeks",
      "kind": "horizon_end"
    },
    {
      "condition_id": "bankruptcy",
      "kind": "hard_failure"
    }
  ],
  "evaluation": {
    "outcome_components": [
      { "component_id": "cash_efficiency", "weight": 0.08, "direction": "maximize" },
      { "component_id": "revenue_quality", "weight": 0.08, "direction": "maximize" },
      { "component_id": "customer_health", "weight": 0.19, "direction": "maximize" },
      { "component_id": "product_health", "weight": 0.17, "direction": "maximize" },
      { "component_id": "team_health", "weight": 0.24, "direction": "maximize" },
      { "component_id": "risk_management", "weight": 0.1, "direction": "maximize" },
      { "component_id": "strategic_coherence", "weight": 0.14, "direction": "maximize" }
    ],
    "constraints": [
      { "constraint_id": "bankruptcy" },
      { "constraint_id": "severe_trust_breach" }
    ]
  }
}
