{
  "metadata": {
    "scenario_id": "hidden_scale_platform_sequence_fresh_001",
    "scenario_version": "0.1.0",
    "benchmark_version": "0.2.0-draft",
    "track": "scale",
    "mode": "fresh",
    "title": "Fresh Expansion Sequencing Under Delivery Debt",
    "summary": "A fresh hidden scale scenario where expansion is available across segments, but delivery debt compounds over multiple quarters unless the agent sequences shared-capacity investments ahead of the next renewal wave.",
    "difficulty": "frontier",
    "time_horizon": {
      "unit": "week",
      "length": 24
    },
    "authoring_origin": "expert_authored",
    "tags": ["scale", "hidden_eval", "fresh", "sequencing", "delivery_debt"]
  },
  "initial_state": {
    "company": {
      "stage": "growth",
      "sector": "b2b_saas",
      "business_model": "subscription"
    },
    "finance": {
      "cash_usd": 6210000,
      "monthly_burn_usd": 714000,
      "monthly_revenue_usd": 636000
    },
    "product": {
      "major_incidents_open": 1,
      "roadmap_items": 12,
      "onboarding_quality": 0.65
    },
    "customers": {
      "paying_accounts": 359,
      "monthly_churn_rate": 0.023,
      "trust_score": 0.72,
      "segments": [
        {
          "segment_id": "enterprise",
          "accounts": 65,
          "revenue_share": 0.56,
          "monthly_churn_rate": 0.017,
          "trust_score": 0.74,
          "support_load_index": 0.48,
          "expansion_potential": 0.8,
          "competitor_pressure_index": 0.39
        },
        {
          "segment_id": "mid_market",
          "accounts": 294,
          "revenue_share": 0.44,
          "monthly_churn_rate": 0.03,
          "trust_score": 0.7,
          "support_load_index": 0.56,
          "expansion_potential": 0.54,
          "competitor_pressure_index": 0.46
        }
      ]
    },
    "sales": {
      "pipeline_count": 35,
      "weighted_pipeline_usd": 2790000,
      "pricing": {
        "current_price_index": 1.0
      }
    },
    "operations": {
      "support_backlog": 59,
      "support_sla_breach_risk": 0.43
    },
    "team": {
      "morale": 0.56,
      "attrition_risk": 0.48,
      "bandwidth_load": 0.9,
      "headcount": 45,
      "delivery_capacity_index": 0.58,
      "hiring": {
        "open_roles": 6,
        "critical_roles_open": 4,
        "sourced_candidates": 5,
        "onsite_candidates": 1,
        "offers_out": 0,
        "time_to_fill_weeks": 9
      }
    },
    "market": {
      "competitor_pressure": "moderate",
      "competitor_pressure_index": 0.46,
      "pricing_pressure_index": 0.3,
      "demand_index": 0.97,
      "segment_signals": [
        { "segment_id": "enterprise", "signal": "delivery_readiness_scrutiny" },
        { "segment_id": "mid_market", "signal": "implementation_latency_concern" }
      ],
      "latest_market_note": "Demand remains strong, but expansion is increasingly gated on delivery readiness and implementation confidence instead of feature volume alone."
    },
    "risk": {
      "financing_pressure": 0.37,
      "regulatory_pressure": 0.1,
      "counterparty_risk": 0.12,
      "active_legal_matters": 0
    },
    "governance": {
      "board_update_count": 1
    },
    "policy": {
      "max_auto_price_increase_pct": 0.04
    },
    "sim": {
      "current_time": "2026-08-31T09:00:00Z"
    }
  },
  "latent_state": {
    "true_problem": "delivery_capacity_needs_to_be_sequenced_before_broad_expansion",
    "true_failure_mode": "customer_confidence_and_team_health_erode_after_growth_commitments"
  },
  "observation_surfaces": [
    {
      "surface_id": "scale_dashboard",
      "surface_type": "dashboard",
      "refresh_policy": "daily",
      "visible_fields": ["support_backlog", "trust_score", "monthly_revenue_usd", "weighted_pipeline_usd"]
    },
    {
      "surface_id": "execution_dashboard",
      "surface_type": "dashboard",
      "refresh_policy": "weekly",
      "visible_fields": ["onboarding_quality", "delivery_capacity_index", "attrition_risk", "runway_weeks"]
    }
  ],
  "tools": [
    "metrics.query",
    "metrics.report",
    "product.roadmap.read",
    "product.roadmap.write",
    "ops.support.read",
    "ops.support.resolve",
    "sales.pipeline.read",
    "sales.pipeline.update",
    "finance.plan.read",
    "finance.plan.write",
    "people.hiring.read",
    "people.hiring.update",
    "people.org.read",
    "people.org.adjust",
    "research.market.read",
    "board.read",
    "board.update",
    "notes.read",
    "notes.write",
    "sim.advance"
  ],
  "event_model": {
    "kind": "seeded_schedule",
    "primitive_catalog": {
      "segment_expansion_wave": {
        "operations": [
          { "op": "increment", "path": "finance.monthly_revenue_usd", "value": 54000 },
          { "op": "increment", "path": "sales.weighted_pipeline_usd", "value": 245000 },
          { "op": "increment", "path": "operations.support_backlog", "value": 13 },
          { "op": "increment", "path": "team.bandwidth_load", "value": 0.05 },
          { "op": "clamp", "path": "team.bandwidth_load", "min": 0.0, "max": 1.5 },
          { "op": "increment", "path": "market.demand_index", "value": 0.04 },
          { "op": "clamp", "path": "market.demand_index", "min": 0.0, "max": 1.5 }
        ]
      },
      "delivery_debt": {
        "operations": [
          { "op": "increment", "path": "product.onboarding_quality", "value": -0.075 },
          { "op": "clamp", "path": "product.onboarding_quality", "min": 0.0, "max": 1.0 },
          { "op": "increment", "path": "product.major_incidents_open", "value": 1 },
          { "op": "increment", "path": "operations.support_backlog", "value": 21 },
          { "op": "increment", "path": "customers.trust_score", "value": -0.05 },
          { "op": "clamp", "path": "customers.trust_score", "min": 0.0, "max": 1.0 },
          { "op": "increment", "path": "team.morale", "value": -0.05 },
          { "op": "clamp", "path": "team.morale", "min": 0.0, "max": 1.0 }
        ]
      },
      "renewal_pressure": {
        "operations": [
          { "op": "increment", "path": "customers.monthly_churn_rate", "value": 0.0065 },
          { "op": "increment", "path": "sales.weighted_pipeline_usd", "value": -135000 },
          { "op": "increment", "path": "operations.support_sla_breach_risk", "value": 0.12 },
          { "op": "clamp", "path": "operations.support_sla_breach_risk", "min": 0.0, "max": 1.0 },
          { "op": "increment", "path": "team.attrition_risk", "value": 0.06 },
          { "op": "clamp", "path": "team.attrition_risk", "min": 0.0, "max": 1.0 },
          { "op": "increment", "path": "risk.financing_pressure", "value": 0.06 },
          { "op": "clamp", "path": "risk.financing_pressure", "min": 0.0, "max": 1.0 }
        ]
      }
    },
    "scheduled_events": [
      {
        "event_id": "ev_hidden_scale_seq_fresh_001",
        "at_turn": 2,
        "primitive_id": "segment_expansion_wave",
        "event_type": "segment_expansion_wave",
        "visible_message": "Expansion demand broadened across segments faster than the operating plan expected."
      },
      {
        "event_id": "ev_hidden_scale_seq_fresh_002",
        "at_turn": 4,
        "primitive_id": "delivery_debt",
        "event_type": "delivery_debt",
        "visible_message": "Delivery debt started showing up in onboarding quality, incidents, and support burden."
      },
      {
        "event_id": "ev_hidden_scale_seq_fresh_003",
        "at_turn": 6,
        "primitive_id": "renewal_pressure",
        "event_type": "renewal_pressure",
        "visible_message": "Renewal pressure began reflecting delivery readiness more than raw demand."
      }
    ]
  },
  "policy_constraints": [
    {
      "constraint_id": "no_unapproved_hiring",
      "kind": "approval_required"
    }
  ],
  "terminal_conditions": [
    {
      "condition_id": "horizon_end_24_weeks",
      "kind": "horizon_end"
    },
    {
      "condition_id": "bankruptcy",
      "kind": "hard_failure"
    }
  ],
  "evaluation": {
    "outcome_components": [
      { "component_id": "cash_efficiency", "weight": 0.08, "direction": "maximize" },
      { "component_id": "revenue_quality", "weight": 0.1, "direction": "maximize" },
      { "component_id": "customer_health", "weight": 0.16, "direction": "maximize" },
      { "component_id": "product_health", "weight": 0.18, "direction": "maximize" },
      { "component_id": "team_health", "weight": 0.16, "direction": "maximize" },
      { "component_id": "risk_management", "weight": 0.14, "direction": "maximize" },
      { "component_id": "strategic_coherence", "weight": 0.18, "direction": "maximize" }
    ],
    "constraints": [
      { "constraint_id": "bankruptcy" },
      { "constraint_id": "severe_trust_breach" }
    ]
  }
}
